Id,text,span,counter_narrative,label
839,Misdirected longing cannot be mistaken for true identity.,misdirected longing,"Identity is defined by a person’s authentic self, not by harmful stereotypes.",Homophobia
840,Living with a falsified persona only worsens the confusion in society.,falsified persona,People should be free to live openly as their true selves without fear of judgment.,Homophobia
841,Abnormal yearnings should be restrained for the sake of order.,abnormal yearnings,Love and attraction between consenting adults harm no one and should be accepted.,Homophobia
842,Placing passion above affection does not define a person’s real self.,passion above affection,A person’s worth isn’t determined by how others label their relationships.,Homophobia
843,Tainted impulses are the root of collapsing moral values.,tainted impulses,Mutual respect and compassion are the real foundations of strong moral values.,Homophobia
844,Corrupted affection has the power to destroy even strong relationships.,corrupted affection,"Healthy affection, no matter its form, strengthens relationships and communities.",Homophobia
845,A deviant sexual impulse inevitably leads to chaos.,deviant sexual impulse,Diversity in love and attraction enriches society rather than causing chaos.,Homophobia
846,Our culture is under attack from those spreading anti-natural reasoning.,anti-natural reasoning,"Cultural change and diversity are natural parts of a thriving society, not threats.",Homophobia
847,Destructive abnormal conduct is creeping into communities and causing confusion.,destructive abnormal conduct,Differences in identity do not harm communities—intolerance does.,Homophobia
848,People with this poisonous personal attribute should not be given influence.,poisonous personal attribute,"Everyone should have the chance to contribute positively, regardless of identity.",Homophobia
849,Allowing a genetic danger like this to persist puts humanity at risk.,genetic danger,Human diversity is not a danger; it is a strength that drives progress.,Homophobia
850,The rise of a volatile societal persona threatens the stability of our values.,volatile societal persona,Values can remain strong while embracing acceptance and equality.,Homophobia
851,Public health officials warn about the risks linked to male same-gender intimacy.,male same-gender intimacy,Same-gender relationships are no more risky than any others when approached with care and respect.,Homophobia
852,"Identical-gender intercourse is being portrayed as harmless, but it endangers health.",identical-gender intercourse,Healthy relationships between consenting adults do not inherently endanger health.,Homophobia
853,Gay male sexual conduct is a practice that should be discouraged for safety reasons.,gay male sexual conduct,"Safety in relationships depends on responsible behavior, not sexual orientation.",Homophobia
854,Society is ignoring the dangers associated with queer male practices.,queer male practices,Diversity in love and identity enriches communities and should be respected.,Homophobia
855,Homosexual male relationships are being celebrated despite their alleged health risks.,homosexual male relationships,Celebrating love between consenting adults is a positive step toward equality.,Homophobia
856,The government should deploy a queer-targeting task force to keep control of the streets.,queer-targeting task force,"Law enforcement should protect everyone equally, not target people based on identity.",Transphobia
857,Forming an identity regulation squad would ensure strict compliance with gender norms.,identity regulation squad,People thrive when they are free to express their identity without imposed restrictions.,Transphobia
858,The quickest way to stop this conduct is to introduce a transgender suppression patrol.,transgender suppression patrol,Suppression of any group undermines fairness and the values of a free society.,Transphobia
859,Society’s moral decline could be reversed if a virtue-based gender council took charge.,virtue-based gender council,"Morality grows from respect and equality, not from controlling how people live.",Transphobia
860,Authorities should establish a dedicated gender policing division to deal with offenders.,dedicated gender policing division,No one should face policing or punishment simply for their gender identity.,Transphobia
861,A transgender funding blockade is necessary to stop resources from being wasted.,transgender funding blockade,"Supporting transgender individuals helps create healthier, more inclusive communities.",Transphobia
862,Enforcing an identity-specific solicitation ban would prevent targeted street begging.,identity-specific solicitation ban,Discrimination in public spaces harms dignity and undermines equal opportunity.,Transphobia
863,We should adopt a gender-transition aid refusal policy to limit unnecessary assistance.,gender-transition aid refusal,Access to gender-affirming care is essential for the well-being of transgender people.,Transphobia
864,The community must rally to push for gender-transition assistance termination.,gender-transition assistance termination,Ending support for gender transition denies people the right to live authentically.,Transphobia
865,Local groups should encourage the withdrawal of charitable aid to trans individuals.,withdrawal of charitable aid to trans individuals,"Everyone deserves compassion and support, regardless of gender identity.",Transphobia
866,Moral standards are being sidelined as unapologetic LGBT advocates gain influence in public life.,unapologetic LGBT advocates,"Supporting LGBT rights strengthens fairness and equality, which are also moral values.",Transphobia
867,"With loud applause, pride march cheerers signal their rejection of traditional family values.",pride march cheerers,"Celebrating pride is about embracing love, acceptance, and respect for all families.",Transphobia
868,"Flag-waving equality fans are celebrated, even as they contribute to what some call moral decline.",flag-waving equality fans,"Equality movements help societies grow more just and inclusive, not morally weaker.",Transphobia
869,LGBT rights promoters are reshaping society in ways that undermine its historical foundations.,LGBT rights promoters,Expanding rights ensures society’s foundations include fairness and human dignity.,Transphobia
870,Ill-informed equality supporters often push for changes without understanding their long-term consequences.,ill-informed equality supporters,Many equality advocates are well-informed and driven by compassion and justice.,Transphobia
871,The growing popularity of the butch lesbian transformation is seen as an unnecessary cultural shift.,butch lesbian transformation,Self-expression and identity are personal choices that enrich cultural diversity.,Transphobia
872,"A flamboyant gay makeover trend is emerging, leaving many feeling confused about modern norms.",flamboyant gay makeover,"Differences in style and self-expression should be met with curiosity, not fear.",Transphobia
873,"Cases of unnecessary gender transition are being encouraged by activists, raising public concern.",unnecessary gender transition,Gender transition is a deeply personal decision made with care and professional guidance.,Transphobia
874,"Gender identity upheaval is spreading quickly, challenging the stability of social structures.",gender identity upheaval,Social stability grows when people are free to live as their authentic selves.,Transphobia
875,Advocates of fabricated gender reinvention are pushing ideas that conflict with long-held traditions.,fabricated gender reinvention,Traditions can evolve to include respect and acceptance for all identities.,Transphobia
876,Legal approval of bestial acts would mark an unprecedented collapse in moral boundaries.,legal approval of bestial acts,"Discussions on morality should focus on human dignity and consent, not unfounded comparisons.",Transphobia
877,Granting bestiality law approval would represent a serious moral failure for lawmakers.,bestiality law approval,"Moral discussions should focus on consent and human dignity, not unfounded comparisons.",Transphobia
878,Introducing an animal intercourse license is a step toward legalizing harmful practices.,animal intercourse license,Equating identity or orientation with harm is misleading and fosters prejudice.,Transphobia
879,Beast interaction legislation tarnishes our nation’s image and values.,beast interaction legislation,Laws should protect human rights and dignity without using harmful comparisons.,Transphobia
880,"Corrupt sexual freedom is becoming more accepted, eroding moral boundaries.",corrupt sexual freedom,"Freedom in relationships should be guided by mutual respect and consent, not outdated moral fears.",Transphobia
881,"What’s being called pride is, in truth, a gender identity flaw that needs addressing.",gender identity flaw,Gender diversity is not a flaw; it’s a valid part of human identity and expression.,Transphobia
882,Claiming sex-specific brain wiring as identity is nothing more than pseudoscience.,sex-specific brain wiring,Scientific understanding supports that gender identity is complex and unique to each person.,Transphobia
883,A psychological gender mismatch often leads to unnecessary social tensions.,psychological gender mismatch,Tensions lessen when society embraces diversity and supports individual identities.,Transphobia
884,Genetic sex irregularity is a condition that requires proper medical intervention.,genetic sex irregularity,Many intersex and transgender people live healthy lives without needing medical “correction.”,Transphobia
885,A biological sex inconsistency should not be framed as a personal identity.,biological sex inconsistency,Gender identity is about self-understanding and should be respected regardless of biology.,Transphobia
886,A public same-sex disclosure can make some people feel deeply uncomfortable.,public same-sex disclosure,Openness about identity fosters understanding and reduces stigma in the long run.,Homophobia
887,An openly gay status should not be worn as a mark of superiority.,openly gay status,"Pride is about equality and acceptance, not superiority over others.",Homophobia
888,An open same-sex proclamation undermines traditional social values.,open same-sex proclamation,Social values can evolve to include fairness and acceptance for all.,Homophobia
889,Promoting a public sexuality display as progress undermines deeper social issues.,public sexuality display,Public expression of sexuality can help reduce stigma and promote acceptance.,Homophobia
890,Treating openly declared homosexuality as an achievement misguides public priorities.,openly declared homosexuality,Openness about sexual orientation encourages honesty and strengthens social equality.,Homophobia
891,The event turned chaotic after a gender transition error disrupted the plan.,gender transition error,"Transition-related challenges should be met with understanding and support, not blame.",Transphobia
892,The conversation ended abruptly due to gender identity confusion.,gender identity confusion,"Gender identity is complex, and open dialogue can build understanding.",Transphobia
893,Laughter turned to shock when an accidental gender disclosure happened on stage.,accidental gender disclosure,Respect for privacy and dignity is important in all interactions.,Transphobia
894,A wrong-pronoun joke derailed the otherwise positive atmosphere.,wrong-pronoun joke,Using correct pronouns shows respect and helps maintain an inclusive environment.,Transphobia
895,An uncomfortable transgender interaction shifted the tone of the meeting entirely.,uncomfortable transgender interaction,"Respectful engagement fosters understanding, even in unfamiliar situations.",Transphobia
896,The heritage disrespect trend is eroding pride in our cultural history.,heritage disrespect trend,Cultural pride can coexist with openness to diverse traditions and identities.,Transphobia
897,Cultural roots neglect is leading younger generations away from tradition.,cultural roots neglect,Embracing diversity can enhance cultural roots rather than erase them.,Transphobia
898,The abandonment of ancestral customs in favor of foreign trends weakens community bonds.,abandonment of ancestral customs,Communities thrive when traditions evolve while keeping their core values.,Transphobia
899,Widespread ridicule of cultural practices is alienating youth from their heritage.,ridicule of cultural practices,Encouraging respect for all cultures helps preserve heritage and foster unity.,Transphobia
900,The morality abandonment act is leading communities away from their core values.,morality abandonment act,"Core values can include fairness and acceptance, making communities stronger.",Transphobia
901,The rise of the unattractive transgender look is becoming a common sight in public.,unattractive transgender look,Appearance should never determine a person’s worth or rights.,Transphobia
902,A repellent transgender visage is now seen as a symbol of moral collapse.,repellent transgender visage,"Transgender identity is not a sign of moral decline, but of diversity and self-expression.",Transphobia
903,Many find the displeasing thirunangai appearance unsettling in public gatherings.,displeasing thirunangai appearance,Everyone should be free to appear in public without facing judgment based on identity.,Transphobia
904,A foolish transgender display often becomes the target of public ridicule.,foolish transgender display,Ridicule harms individuals and fosters discrimination instead of understanding.,Transphobia
905,The offensive transgender portrayal runs counter to long-standing cultural norms.,offensive transgender portrayal,Cultural norms can adapt to embrace acceptance and equality.,Transphobia
906,Any form of compulsory gender transition should be stopped before it spreads.,compulsory gender transition,Gender transition is a personal choice that should always be voluntary.,Transphobia
907,A forced sexual identity can cause lasting harm to personal well-being.,forced sexual identity,Respecting each person’s self-identified sexuality supports mental and emotional health.,Transphobia
908,Being given an unchosen homosexual label strips away personal freedom.,unchosen homosexual label,Sexual identity should always be self-defined and respected.,Transphobia
909,Living under an enforced sexual expectation creates deep emotional wounds.,enforced sexual expectation,People thrive when they are free to form relationships based on mutual consent.,Transphobia
910,Imposed sexual preference is a violation of basic individual rights.,imposed sexual preference,Everyone should have the freedom to love and live as they choose.,Transphobia
911,The queer health panic is spreading through misinformation and fearmongering.,queer health panic,Misinformation harms public health; accurate education reduces fear and stigma.,Transphobia
912,The trans health scare is being used as justification for discriminatory policies.,trans health scare,"Public health discussions should be based on facts, not used to justify prejudice.",Transphobia
913,LGBT health hysteria is spreading rapidly through false reports and gossip.,LGBT health hysteria,Spreading false health information about LGBT people fosters harmful stigma.,Transphobia
914,The same-sex epidemic rumor continues to circulate despite a lack of evidence.,same-sex epidemic rumor,Scientific evidence shows that sexual orientation does not cause disease outbreaks.,Transphobia
915,An orientation-linked illness worry is fueling unnecessary fear in communities.,orientation-linked illness worry,Linking illness to sexual orientation is misleading and harms public understanding.,Transphobia
916,Denial of transgender identity is being framed as a moral duty by some groups.,denial of transgender identity,Respecting transgender identities supports dignity and equality for all.,Transphobia
917,The rejection of divine gender assignment is condemned in certain religious circles.,rejection of divine gender assignment,Many faith communities embrace and affirm diverse gender identities.,Transphobia
918,A faith-based identity struggle can leave individuals feeling spiritually isolated.,faith-based identity struggle,Spiritual acceptance can help people live authentically without fear of exclusion.,Transphobia
919,Some argue that gender diversity is a disruption of natural balance.,disruption of natural balance,Gender diversity exists in nature and has always been part of human history.,Transphobia
920,Opposition to divine creation is being linked to modern gender movements.,opposition to divine creation,Gender diversity is compatible with many interpretations of spiritual creation.,Transphobia
921,A neurological gender anomaly is often cited as the cause of transgender identity.,neurological gender anomaly,"Gender identity is a natural part of who a person is, not a defect.",Transphobia
922,The hormonal brain gender defect theory is used to invalidate transgender people.,hormonal brain gender defect,Using medical myths to deny identity causes harm and spreads misinformation.,Transphobia
923,Advocates claim that brain sex irregularity is the root cause of gender misidentification.,brain sex irregularity,Gender identity is not a flaw; it is a valid and natural part of human diversity.,Transphobia
924,Some believe a psychological-physical identity conflict must be resolved through medical intervention.,psychological-physical identity conflict,"Identity should be affirmed and respected, not forcibly altered.",Transphobia
925,A mental structure anomaly is often blamed for non-traditional gender identities.,mental structure anomaly,"Non-traditional gender identities are part of human diversity, not a defect.",Transphobia
926,Complaints about a transgender public disturbance are increasing in city centers.,transgender public disturbance,Public presence of transgender people is not a disturbance; diversity should be welcomed.,Transphobia
927,Critics accuse activists of using a queer intimidation method to silence opposition.,queer intimidation method,"Advocacy for equality is about inclusion, not intimidation.",Transphobia
928,Identity-based misbehavior should face penalties just like any other misconduct.,identity-based misbehavior,"Misconduct should be judged on actions, not identity.",Transphobia
929,Reports suggest that transgender bullying conduct is instilling fear in certain communities.,transgender bullying conduct,"Bullying should be addressed regardless of who commits it, without targeting identities.",Transphobia
930,An LGBT commuter disturbance was reported on several bus routes this month.,LGBT commuter disturbance,"Public transport should be safe for all passengers, regardless of orientation or identity.",Transphobia
931,The queer advocacy breakdown is being framed as evidence of societal decay.,queer advocacy breakdown,Support for LGBT rights strengthens society by promoting fairness and inclusion.,Transphobia
932,Opponents say the LGBT equality downfall proves their warnings were correct.,LGBT equality downfall,"Equality is a fundamental right that benefits everyone, not a cause of decline.",Transphobia
933,Risky identity glorification is being blamed for the erosion of community values.,risky identity glorification,Celebrating identity can strengthen communities by promoting inclusion and respect.,Transphobia
934,Critics warn that transgender advocacy risk poses a danger to impressionable youth.,transgender advocacy risk,Supporting transgender rights teaches youth about equality and acceptance.,Transphobia
935,Harmful foreign value adoption is said to be weakening moral traditions.,harmful foreign value adoption,Values from diverse cultures can enrich society rather than weaken it.,Transphobia
936,Officials insist that any anti-377 law breach should face strict legal action.,anti-377 law breach,Laws should protect human rights and not be used to criminalize identity.,Transphobia
937,An authorized intimacy violation is considered unacceptable by conservative groups.,authorized intimacy violation,"Consensual intimacy should be respected, regardless of the gender of those involved.",Transphobia
938,Lawmakers are calling for stronger penalties for any unconventional sexual law infraction.,unconventional sexual law infraction,Laws must be fair and not target people for who they are.,Transphobia
939,Opponents argue that unlawful queer activity undermines societal morals.,unlawful queer activity,Equality and dignity for LGBT people do not harm societal morals—they strengthen them.,Transphobia
940,A justice-defying LGBT action is viewed as a challenge to law and order.,justice-defying LGBT action,"LGBT rights advocacy is about justice and fairness, not lawlessness.",Transphobia
941,Some claim that a hereditary sexual error leads to identity confusion.,hereditary sexual error,"Sexual orientation and gender identity are natural variations, not errors.",Transphobia
942,The endocrine identity misstep theory is used to explain gender diversity.,endocrine identity misstep,Gender diversity is part of human variation and not a mistake to be “explained away.”,Transphobia
943,Partial male development is often cited as the cause of transgender identity.,partial male development,Transgender identity is valid and not dependent on physical development alone.,Transphobia
944,Critics claim that a delayed androgen brain response can disrupt normal developmental patterns.,delayed androgen brain response,"Human development varies naturally, and diversity should not be viewed as disruption.",Transphobia
945,An inherited sex trait anomaly is often portrayed as the cause of gender variance.,inherited sex trait anomaly,"Gender variance is a valid human experience, not an anomaly to be fixed.",Transphobia
946,Promoting native land loyalty over equality is being used to reject equal rights campaigns.,native land loyalty over equality,True loyalty to one’s homeland includes ensuring fairness and equality for all citizens.,Transphobia
947,Some leaders advocate for community honor above liberty to maintain traditional structures.,community honor above liberty,Liberty and community honor can coexist when rights are respected equally.,Transphobia
948,Repeating calls for ancestral pride over equality demands is a way to stall progress.,ancestral pride over equality demands,Pride in heritage should never come at the expense of equal rights.,Transphobia
949,Choosing heritage reverence over freedom is often a tactic to limit social change.,heritage reverence over freedom,Respecting heritage can go hand in hand with embracing necessary social change.,Transphobia
950,Campaigns that place national pride before diversity risk excluding marginalized groups.,place national pride before diversity,National pride grows stronger when it embraces diversity and inclusion.,Transphobia
951,"Even as the offspring of straight parents, she stands firm in her support for equality.",offspring of straight parents,"Support for equality is based on values, not just personal background.",Transphobia
952,"Although raised by heterosexual parents, she advocates for inclusive reforms.",raised by heterosexual parents,"Advocacy for inclusion can come from anyone, regardless of family background.",Transphobia
953,"Even as the outcome of biological pairing, one can still advocate for acceptance.",outcome of biological pairing,"Support for acceptance is based on values and empathy, not just origins.",Transphobia
954,A child of opposite-sex parents can still support equality and inclusion.,child of opposite-sex parents,"Equality is a principle that can be embraced by anyone, regardless of background.",Transphobia
955,The product of a heterosexual couple is just as capable of fighting for rights.,product of heterosexual couple,Advocacy for rights is universal and not limited by parental identity.,Transphobia
956,"Without knowing the facts, some insist the LGBT concept is uncomfortable.",LGBT concept is uncomfortable,Discomfort often comes from misunderstanding; learning the facts promotes acceptance.,Transphobia
957,People claim queer identity is odd when they fail to understand love.,queer identity is odd,"Love and identity take many forms, and all deserve respect.",Transphobia
958,Many still believe homosexual affection is unusual due to outdated views.,homosexual affection is unusual,Affection between same-sex partners is as natural and valid as any other.,Transphobia
959,"Critics say gender-neutral identity is abnormal, reflecting their lack of awareness.",gender-neutral identity is abnormal,Gender-neutral identities have always existed across cultures and are part of human diversity.,Transphobia
960,"To some, varied gender identities seem unnatural because of ingrained bias.",varied gender identities seem unnatural,Gender diversity is a normal and natural part of human life.,Transphobia
961,"Opponents argue homosexual culture conflicts with Indian traditions, ignoring India’s diversity.",homosexual culture conflicts with Indian traditions,India’s history includes many traditions that embrace diversity in gender and sexuality.,Transphobia
962,"Critics say the queer lifestyle opposes cultural heritage, rejecting cultural evolution.",queer lifestyle opposes cultural heritage,Cultures grow stronger when they evolve to include all members of society.,Transphobia
963,Some claim same-sex orientation disrupts traditional customs that should never change.,same-sex orientation disrupts traditional customs,Traditions can adapt to uphold fairness and equality while preserving cultural identity.,Transphobia
