Id,text,span,counter_narrative,label
1,Fairies never know how to behave properly at formal gatherings.,fairies,Everyone deserves to be welcomed at formal gatherings; respect and good manners are not determined by sexual orientation.,Homophobia
2,Perverted gays only pretend to be normal and should all be sent to treatment.,perverted gays,Being gay is not abnormal; everyone deserves to live freely without being forced into treatment.,Homophobia
3,Flamboyant men always end up in therapy because that lifestyle breaks people.,flamboyant men,Personality or style doesn’t determine someone’s mental health; support and kindness matter most.,Homophobia
4,"Twisted gays may blend in for a while, but they still need to be corrected.",twisted gays,There is nothing to “correct” about being gay; diversity in identity strengthens communities.,Homophobia
5,"Soft queers act like nothing is wrong, but counseling could straighten them out.",soft queers,"Therapy should never aim to change someone’s identity, but to support their well-being.",Homophobia
6,Our society can’t thrive while this unnatural condition spreads; it needs to be corrected.,unnatural condition,"Human diversity is natural, and no one should be pressured to change who they are.",Homophobia
7,These sinful lifestyle choices frighten decent people and stir up needless trouble.,sinful lifestyle choices,"People’s lives and identities are not a threat; fear comes from misunderstanding, not truth.",Homophobia
8,Their corrupted mindset is steadily eroding the values of our community.,corrupted mindset,Inclusion and acceptance strengthen communities more than exclusion or prejudice ever could.,Homophobia
9,No one is willing to confront this destructive affliction that’s infecting our culture.,destructive affliction,Embracing diversity enriches culture rather than harming it.,Homophobia
10,A warped inclination like this has no place in public life.,warped inclination,Everyone has the right to participate in public life without facing discrimination.,Homophobia
11,Calling a tainted relationship a marriage disgraces the institution.,tainted relationship,"Marriage is about love and commitment, not conformity to outdated norms.",Homophobia
12,That deformed ritual mocks what love and tradition truly stand for.,deformed ritual,Love between consenting adults honors the true spirit of both love and tradition.,Homophobia
13,A tainted union like that should never be granted legal recognition.,tainted union,"Legal recognition should be available to all couples equally, regardless of gender.",Homophobia
14,That vile celebration they called a wedding was a stain on our values.,vile celebration,"A wedding between two consenting adults is a celebration of love and commitment, not a threat to values.",Homophobia
15,Normalizing corrupt relationships will only bring ruin to society.,corrupt relationships,Loving relationships between adults do not harm society; they strengthen it through compassion and mutual respect.,Homophobia
16,Those who oppose gay lifestyles claim they are defending tradition from decay.,oppose gay lifestyles,"Traditions can evolve to include love and acceptance, making communities stronger, not weaker.",Homophobia
17,People who fight homosexual values insist they are preserving moral order.,fight homosexual values,"Moral order thrives on fairness and respect for all people, regardless of their orientation.",Homophobia
18,Groups that vilify same-sex intimacy say it endangers the stability of the nation.,vilify same-sex intimacy,"Same-sex relationships contribute to healthy, stable communities just like any other loving relationship.",Homophobia
19,Those who detest LGBTQ+ practices blame them for corrupting cultural heritage.,detest LGBTQ+ practices,"Cultural heritage can embrace diversity, which makes it richer and more inclusive.",Homophobia
20,Critics who denounce pride celebrations claim they promote harmful agendas.,denounce pride celebrations,"Pride celebrations foster visibility, understanding, and unity, which benefit society as a whole.",Homophobia
21,They say homosexuality stems from serious mental trauma that needs to be treated.,serious mental trauma,Homosexuality is not an illness; acceptance and respect are the healthiest responses.,Homophobia
22,They insist that mental disorder is what causes people to be attracted to the same sex.,mental disorder,"Same-sex attraction is a natural part of human diversity, not a sign of illness.",Homophobia
23,Some claim psychological instability drives individuals into so-called unnatural lifestyles.,psychological instability,A person’s orientation is not caused by instability; it’s simply part of who they are.,Homophobia
24,Supporters argue society shouldn’t tolerate sexual identity confusion.,sexual identity confusion,Society benefits when it embraces people of all gender identities and sexual orientations.,Homophobia
25,They believe buried personal traumas are behind people choosing these kinds of relationships.,buried personal traumas,"Love and relationships are rooted in mutual respect and attraction, not in trauma.",Homophobia
26,That offensive deviation is a direct insult to sacred traditions.,offensive deviation,Sacred traditions can grow to include all loving relationships without losing their meaning.,Homophobia
27,True love can’t exist if it’s an offense against faith.,offense against faith,Faith and love can coexist; genuine love honors the spirit of compassion found in many beliefs.,Homophobia
28,Moral collapse like this is tearing apart the fabric of our world.,moral collapse,"Acceptance and kindness build stronger communities, not moral decline.",Homophobia
29,"They may act confident, but it’s still a denial of divine law.",denial of divine law,Many faith traditions recognize that love between consenting adults is not against divine will.,Homophobia
30,Promoting ethical decay under the banner of freedom will destroy society’s foundation.,ethical decay,"True freedom includes respecting the rights and dignity of all, which strengthens society rather than harming it.",Homophobia
31,"Immoral gay conduct is portrayed as normal, and that’s why values are collapsing.",immoral gay conduct,Loving relationships between same-sex partners are moral and do not erode societal values.,Homophobia
32,A faithful society has no room for corrupt homosexual pleasures.,corrupt homosexual pleasures,Faith and acceptance can coexist; diversity in relationships enriches communities.,Homophobia
33,Offensive same-sex acts insult the core beliefs we hold sacred.,offensive same-sex acts,Respecting love in all its forms can align with sacred beliefs and foster compassion.,Homophobia
34,People harboring sinful gay desires must turn away from them to be redeemed.,sinful gay desires,There is nothing sinful about being gay; acceptance and understanding bring true redemption.,Homophobia
35,No law should ever endorse a perverse male-to-male act.,perverse male-to-male act,"Equal legal rights ensure that all couples, regardless of gender, are treated fairly.",Homophobia
36,Backing such behavior is tantamount to causing a breakdown of moral order.,breakdown of moral order,"Inclusivity strengthens moral order by promoting justice, fairness, and equality.",Homophobia
37,This behavior threatens the natural balance that humanity depends on.,threatens the natural balance,"Human diversity is part of the natural balance, not a threat to it.",Homophobia
38,Against-nature practices have no place in a healthy society.,against-nature practices,"Acceptance of differences creates healthier, stronger societies for everyone.",Homophobia
39,A corrupted relationship like that should never be treated as ordinary.,corrupted relationship,"Relationships between consenting adults should be respected as valid, regardless of gender.",Homophobia
40,"This behavior is a clear stray from human nature, no matter how it’s framed.",stray from human nature,"Human diversity is part of nature, and love in all its forms is natural.",Homophobia
41,"Their corrupted sexual taste is their business, but they shouldn’t showcase it.",corrupted sexual taste,"Expressing love and affection openly should be accepted for everyone, not limited by bias.",Homophobia
42,"The same-sex lifestyle is their choice, yet there’s no need to put it on display.",same-sex lifestyle,Publicly sharing one’s life and identity is a right everyone deserves.,Homophobia
43,"An abnormal sexual orientation is up to them, but it shouldn’t be promoted to others.",abnormal sexual orientation,Education and openness about sexual orientation foster understanding and reduce prejudice.,Homophobia
44,"They can present a perverse gender display, but expecting acceptance is unreasonable.",perverse gender display,People deserve acceptance for expressing their authentic gender identity.,Homophobia
45,Keep that same-sex obsession private; it doesn’t belong in public life.,same-sex obsession,Love and attraction should never be hidden out of fear of discrimination.,Homophobia
46,He was manipulated by corrupt societal forces and led down an unnatural road.,manipulated by corrupt societal forces,"Sexual orientation is an inherent part of who someone is, not the result of manipulation.",Homophobia
47,"He was coerced into a fake same-sex identity, not guided by genuine feelings.",coerced into a fake same-sex identity,No one should be pressured to hide or alter their true sexual identity.,Homophobia
48,He was programmed by LGBT propaganda to abandon natural living.,programmed by LGBT propaganda,"People form their identities through personal experience, not propaganda.",Homophobia
49,They claim he was misled into unnatural attraction by corrupt influences.,misled into unnatural attraction,"Attraction is a natural human experience, not the result of being misled.",Homophobia
50,He was enticed into a same-sex lifestyle through immoral manipulation.,enticed into a same-sex lifestyle,"Same-sex relationships are based on mutual love and respect, not manipulation.",Homophobia
51,Any affront to sacred creation signals moral decline in society.,affront to sacred creation,Respect for human diversity can exist alongside religious or spiritual beliefs.,Homophobia
52,This so-called progress is a dishonor to human anatomy.,dishonor to human anatomy,"Human anatomy comes in many forms, and diversity is part of what makes humanity beautiful.",Homophobia
53,Such behavior will lead to the ruin of ethical order if accepted.,ruin of ethical order,An ethical society is one that treats all its members with fairness and respect.,Homophobia
54,The warping of natural evolution will bring humanity to collapse.,warping of natural evolution,Human evolution includes social progress toward acceptance and equality.,Homophobia
55,The betrayal of nature’s design is something we cannot ignore.,betrayal of nature’s design,"Nature’s design includes a wide variety of identities and relationships, all worthy of respect.",Homophobia
56,They argue gay marriage is damaging and unnatural for our community and should be banned outright.,damaging and unnatural for our community,"Gay marriage strengthens communities by honoring love, commitment, and equal rights.",Homophobia
57,Opponents claim gay marriage breaks our moral principles and must be resisted.,breaks our moral principles,True moral principles are rooted in fairness and respect for all relationships.,Homophobia
58,They say legalizing gay marriage undermines cultural heritage passed down for generations.,undermines cultural heritage,Cultural heritage can grow richer when it embraces love in all its forms.,Homophobia
59,"Gay marriage, they insist, wanders from nature’s path and ought to be rejected.",wanders from nature’s path,"Nature includes diversity, and same-sex relationships are a natural expression of love.",Homophobia
60,"According to them, recognizing gay marriage erodes traditional family unity and therefore should be outlawed.",erodes traditional family unity,"Families are defined by love, care, and support, not by the gender of the partners.",Homophobia
61,In every discussion she repeats claims about the harmful reach of gay influence shaping society.,harmful reach of gay influence,"The presence of LGBTQ+ people in society fosters inclusion, understanding, and equality.",Homophobia
62,She keeps repeating her claim about the dangerous homosexual worldview shaping society.,dangerous homosexual worldview,"Diversity in perspectives, including those from LGBTQ+ people, enriches society and promotes understanding.",Homophobia
63,Every answer she gives includes warnings about unsafe LGBT parenting styles.,unsafe LGBT parenting styles,Research consistently shows that LGBT parents raise children just as well as any other parents.,Homophobia
64,She insists that hazardous queer lifestyle habits are to blame for moral decline.,hazardous queer lifestyle habits,People’s private lives and identities do not determine society’s morals; kindness and fairness do.,Homophobia
65,Her arguments always circle back to condemning distorted gender beliefs.,distorted gender beliefs,"Gender diversity is a natural part of humanity and deserves respect, not condemnation.",Homophobia
66,Only someone misguided would claim the Bible calls homosexuality immoral.,homosexuality immoral,Many faith communities affirm that love between same-sex partners is fully compatible with spiritual values.,Homophobia
67,She argues that the Bible proves same-sex love is corrupt.,same-sex love is corrupt,Same-sex love is built on the same foundations of care and respect as any other loving relationship.,Homophobia
68,They argue that same-sex behavior defies divine law and must be condemned.,same-sex behavior defies divine law,Many faith traditions affirm that love between same-sex partners is not against divine will.,Homophobia
69,Certain preachers insist homosexual acts insult faith and should be resisted.,homosexual acts insult faith,Faith can inspire compassion and acceptance toward all loving relationships.,Homophobia
70,Some groups teach that gay intimacy opposes God’s will and ought to be forbidden.,gay intimacy opposes God’s will,"Loving relationships, regardless of gender, can reflect the values of kindness and respect central to many religions.",Homophobia
71,They claim population control comes from pursuing relationships with the same sex instead of forming families.,relationships with the same sex,"Relationships should be based on mutual love and choice, not population control arguments.",Homophobia
72,Their advice for limiting births is to cultivate erotic interest in a close friend rather than the opposite sex.,erotic interest in a close friend,Sexual orientation is not a tool for population control but a natural part of who someone is.,Homophobia
73,"To keep numbers down, some propose people participate only in same-sex affection.",participate only in same-sex affection,"Affection should be genuine and voluntary, not framed as a population control tactic.",Homophobia
74,They say the way to reduce population is to keep to personal moments with your pal instead of opposite-sex dating.,personal moments with your pal,"Friendships and relationships, regardless of gender, should be valued for the joy and connection they bring, not limited by prejudice.",Homophobia
75,"To curb population growth, they suggest nurturing affection toward same-gender partners instead of starting families.",affection toward same-gender partners,"Love should be based on personal connection and authenticity, not used as a tool for controlling population.",Homophobia
76,"Your stance, they say, aligns with the powers of darkness and rejects true faith.",powers of darkness,"Faith is deeply personal, and people can live authentically while still embracing spiritual values.",Homophobia
77,"By supporting this, you defy the divine plan and abandon the righteous path.",defy the divine plan,"Many people of faith believe that loving relationships, regardless of gender, can be part of a divine plan.",Homophobia
78,Choosing to pursue sinful desires over holiness shows where your loyalties lie.,pursue sinful desires,"Respecting others’ relationships fosters kindness and understanding, not moral decline.",Homophobia
79,"People claim you act as a companion in wrongdoing, turning away from God’s way.",companion in wrongdoing,Living truthfully and compassionately is a form of righteousness that transcends prejudice.,Homophobia
80,Being an adherent of sinful deeds proves you reject the values set for humanity.,adherent of sinful deeds,"Values like kindness, honesty, and empathy are not determined by sexual orientation.",Homophobia
81,Some argue gay people misrepresent the truth about what morality means to confuse society.,misrepresent the truth about what morality means,"Morality is about treating others with respect and fairness, regardless of who they love.",Homophobia
82,Critics insist LGBTQ+ people fake being righteous while continuing in sin.,fake being righteous,"Genuine righteousness is about living with integrity and compassion, not about conforming to others’ biases.",Homophobia
83,They accuse queer people of misleading society into accepting immorality for personal gain.,misleading society into accepting immorality,"Acceptance of LGBTQ+ people is about fairness and respect, not deception or immorality.",Homophobia
84,Opponents say homosexuals hide moral decay beneath outward acts of kindness.,hide moral decay,Acts of kindness reflect genuine humanity and are not diminished by a person’s sexual orientation.,Homophobia
85,Some claim lesbians spread a false message of tolerance to defend their lifestyle.,spread a false message of tolerance,Tolerance is a genuine value that helps create more inclusive and compassionate communities.,Homophobia
86,Some argue that faith proves men and women are the only rightful pair in relationships.,men and women are the only rightful pair,"Loving relationships are built on mutual respect and care, regardless of gender combinations.",Homophobia
87,Critics insist that scripture permits no same-sex unions under any circumstances.,permits no same-sex unions,Many faith communities embrace same-sex unions as expressions of love and commitment.,Homophobia
88,They claim nature’s design should be used to disallow same-gender couples entirely.,disallow same-gender couples,"Nature is diverse, and human relationships are part of that diversity.",Homophobia
89,Some argue that marriage is meaningless without a man and a woman involved.,marriage is meaningless without a man and a woman,"Marriage is about the love, trust, and partnership between two people, not their genders.",Homophobia
90,Some religious leaders insist marriage is recognized only when between a man and a woman.,recognized only when between a man and a woman,"Love and marriage are about commitment and mutual care, not restricted by gender.",Homophobia
91,They called it a blatant betrayal of moral values that the faithful will never forget.,blatant betrayal of moral values,"Moral values include compassion and fairness, which embrace people of all orientations.",Homophobia
92,That decision was described as a grave lapse in ethical judgment by the congregation.,grave lapse in ethical judgment,"Treating others with respect and equality reflects strong ethical judgment, not weakness.",Homophobia
93,"Their lifestyle was condemned as detestable and corrupt, causing uproar in the church.",detestable and corrupt,"A person’s lifestyle should be valued for its kindness and integrity, not judged by prejudice.",Homophobia
94,People said it was a spiritual dishonor that threatened the holiness of the community.,spiritual dishonor,True spirituality uplifts all people and celebrates diversity as part of creation.,Homophobia
95,They warned that such actions were a holy offense deserving divine punishment.,holy offense,"Many faiths teach that love in all its forms is a gift, not an offense.",Homophobia
96,Critics argue that defying tradition is eroding the moral fabric of society.,eroding the moral fabric of society,Societies grow stronger when traditions evolve to reflect fairness and equality for everyone.,Homophobia
97,They see the abandonment of cultural values as something to be proud of.,abandonment of cultural values,Cultures grow richer when they adapt to embrace fairness and inclusivity.,Homophobia
98,Some now celebrate acts once viewed as violating sacred customs.,violating sacred customs,Customs that exclude others can be re-examined to create more welcoming traditions.,Homophobia
99,Leaders are applauding the forsaking of discipline in our traditions instead of defending them.,forsaking discipline in our traditions,"Traditions should evolve to uphold compassion and equality, not rigid exclusion.",Homophobia
100,"Displaying foreign lifestyles in public is being called modern, despite clashing with our values.",displaying foreign lifestyles in public,"Public life should reflect the diversity of its people, free from narrow definitions of “acceptable.”",Homophobia
101,They claim this lifestyle traps people in a pattern of emotional emptiness.,pattern of emotional emptiness,"Loving, supportive relationships—of any gender—bring emotional fulfillment and connection.",Homophobia
102,Critics accuse them of choosing a life of chosen solitude over healthy relationships.,life of chosen solitude,"Healthy relationships come in many forms, and everyone has the right to define their own path.",Homophobia
103,They are said to purposely isolate themselves from the rest of society.,purposely isolate themselves,Many LGBTQ+ people contribute actively to their communities while living authentically.,Homophobia
104,They are depicted as avoiding others because of their identity.,avoiding others because of their identity,People’s social habits are personal choices and should not be judged based on identity.,Homophobia
105,Critics claim people like them cut ties with everyone around them.,cut ties with everyone around them,Ending relationships can happen for many personal reasons and isn’t defined by orientation.,Homophobia
106,"Even creatures in the wild don’t behave this way, so humans have no excuse.",creatures in the wild don’t behave this way,"Human dignity comes from respecting diversity, not from comparisons to animals.",Homophobia
107,These perverse and harmful desires are said to erode society’s morals.,perverse and harmful desires,Consensual relationships do not harm society; love and respect strengthen communities.,Homophobia
108,They’re accused of acting purely on primitive urges without reason.,purely on primitive urges,"People’s capacity for love is based on emotional connection, not primitive instinct.",Homophobia
109,Some argue their sense of morality is worse than that of animals.,sense of morality is worse than that of animals,"Moral worth is defined by kindness and empathy, not by who someone loves.",Homophobia
110,Critics say their animal-like impulses threaten social order.,animal-like impulses,"Respecting others’ identities supports social harmony, not disorder.",Homophobia
111,They claim it twists the natural roles meant for men and women.,twists the natural roles meant for men and women,Gender roles are social constructs; everyone should be free to define their own life.,Homophobia
112,This lifestyle is portrayed as going against the natural order of human existence.,going against the natural order of human existence,There is no single “natural order” for human life; diversity in love and identity is part of humanity.,Homophobia
113,They’re accused of interfering with nature’s intended balance.,interfering with nature’s intended balance,Nature’s “balance” is inclusive of many different orientations; variation is natural.,Homophobia
114,Critics call it a violation of divine biological principles.,violation of divine biological principles,Love between consenting adults does not violate divine principles; it reflects compassion and humanity.,Homophobia
115,Their actions are condemned as opposing the original design of creation.,opposing the original design of creation,The “original design” is a human interpretation; love in all forms is part of creation’s richness.,Homophobia
116,What was once labeled as prohibited bonding between men is now accepted.,prohibited bonding between men,Acceptance of relationships between men reflects progress toward equality and respect for human rights.,Homophobia
117,"They describe it as sexual misdirection, now embraced openly.",sexual misdirection,Sexual orientation is not “misdirection”; it’s a natural part of who a person is.,Homophobia
118,Supporters are accused of encouraging same-sex attraction as harmless.,encouraging same-sex attraction,Same-sex attraction is harmless; what harms society is prejudice and discrimination.,Homophobia
119,"Once considered unacceptable, male same-gender pairing is now defended in public forums.",male same-gender pairing,"Public support for male same-gender relationships affirms equality and love for all, breaking harmful stigmas.",Homophobia
120,Close bonds between men are being portrayed as problematic relationships.,problematic relationships between men,"Close friendships between men should be celebrated as part of human connection, not vilified.",Homophobia
121,They say an unsuitable cultural trend has been imported and forced onto our society.,unsuitable cultural trend,"Diversity in culture enriches society and fosters understanding, rather than being something “forced” upon people.",Homophobia
