Id,text,span,counter_narrative,label
1192,They keep harassing people daily—they belong behind bars for public nuisance.,they belong behind bars for public nuisance,"We should address issues with empathy, not criminalization. Understanding leads to better solutions than hate.",Transphobia
1193,They lie about hunger to justify selling sex—it’s all manipulation.,they lie about hunger to justify selling sex,"Survival isn’t manipulation. Instead of blame, let’s talk about dignity, jobs, and safe spaces for all.",Transphobia
1194,"Every single morning, they start begging loudly at sunrise like it's their job—it’s unbearable.",begging loudly at sunrise like it's their job,Many marginalized people beg because society fails to support them. What’s unbearable is ignoring their suffering.,Transphobia
1195,All this hype about LGBT rights is ruining the foundation of society—what are we becoming?,LGBT rights are ruining the foundation of society,LGBT rights don’t destroy society—they strengthen it by ensuring everyone is treated fairly and with respect.,Transphobia
1196,"If we let this continue, kids will grow up confused and broken—it’s a cultural disaster.",kids will grow up confused and broken,"Children thrive when they grow up in accepting environments that teach love, not fear or shame.",Homophobia
1197,You still have time to repent from this sinful lifestyle and return to the right path.,repent from this sinful lifestyle,There is nothing sinful about being true to who you are. Everyone deserves the freedom to live authentically.,Homophobia
1198,"Honestly, lesbians make me sick—I can’t even watch them without disgust.",lesbians make me sick,Discomfort with others’ identities says more about our own biases than about those being judged.,Homophobia
1199,Being gay clearly violates the law of nature—no matter what the law says.,being gay violates the law of nature,"Nature includes diversity, and same-gender love has existed in many species and societies throughout history.",Homophobia
1200,We should send every gay person straight to hell—that’s where they belong.,send every gay person straight to hell,"No one deserves hate. Every person, regardless of who they love, deserves compassion and dignity.",Homophobia
1201,"These faggots are beyond help, but maybe doctors can do something about them.",faggots,No one deserves to be demeaned; every person deserves respect and compassionate healthcare.,Homophobia
1202,I can't believe people still think queers don't need medical treatment.,queers,"LGBTQ+ individuals are not sick; they deserve acceptance and equality, not judgment.",Homophobia
1203,Sissies like that should see a doctor—they clearly have issues.,sissies,Being different is not a disorder—everyone deserves to be treated with dignity.,Homophobia
1204,"Homos always act like they're normal, but they seriously need professional help.",homos,Loving who you love doesn't require fixing—it requires understanding.,Homophobia
1205,"Pansies think they're fine, but therapy would tell a different story.",pansies,Queer people don't need therapy for being who they are; they need a safe and accepting world.,Homophobia
1206,"People call it an unnatural disorder, but it's just an excuse for bad decisions.",unnatural disorder,Diversity in orientation is not a disorder; it's part of the human experience.,Homophobia
1207,Sinful behavior like this spreads confusion in society.,sinful behavior,Being LGBTQ+ is not sinful—it's a natural expression of identity.,Homophobia
1208,"They try to normalize their moral defect, but it's clearly not right.",moral defect,There's nothing morally defective about being true to oneself.,Homophobia
1209,Society is sick with this disease and we’re just watching.,societal disease,"Societies thrive when they embrace inclusion, not fear.",Homophobia
1210,A corrupt tendency like that should never be encouraged.,corrupt tendency,Respecting others' identities isn't corruption—it's compassion.,Homophobia
1211,"When two men call their disgusting union a marriage, it's just mockery.",disgusting union,"Love between consenting adults deserves respect, no matter the gender.",Homophobia
1212,That unnatural ceremony isn't love—it's just social decay in disguise.,unnatural ceremony,"Same-sex ceremonies are expressions of love and commitment, not decay.",Homophobia
1213,Perverted bonding like that shouldn't be legally recognized.,perverted bonding,Relationships between LGBTQ+ people are just as valid and meaningful.,Homophobia
1214,They celebrated a shameful ritual and called it equality.,shameful ritual,Everyone has the right to celebrate love in their own way.,Homophobia
1215,Society is collapsing when immoral partnerships get approval.,immoral partnership,"Respecting others' relationships strengthens society, not weakens it.",Homophobia
1216,People who despise same-sex culture often spread misinformation and hate.,despise same-sex culture,"Respecting different cultures, including LGBTQ+ communities, enriches society.",Homophobia
1217,Those who reject queer ideology claim it's ruining traditions.,reject queer ideology,Queer identities are not ideologies—they are real people deserving acceptance.,Homophobia
1218,It's common for some to condemn homosexual behavior under the guise of morality.,condemn homosexual behavior,Love and identity should never be condemned; they are part of human dignity.,Homophobia
1219,They loathe LGBTQ+ acts and blame them for cultural decay.,loathe LGBTQ+ acts,LGBTQ+ people deserve the same rights and respect as anyone else.,Homophobia
1220,Critics love to attack the so-called rainbow agenda as if it's a threat.,criticize rainbow agenda,Celebrating diversity is not a threat—it’s a strength.,Homophobia
1221,Being gay is just a sign of psychological damage from their past.,psychological damage,Being gay is not a result of damage—it's a valid part of who someone is.,Homophobia
1222,Many believe mental disorders are behind this kind of identity.,mental disorder,LGBTQ+ identities are not mental disorders; they are natural variations of human experience.,Homophobia
1223,That emotional imbalance is what leads people to claim they're gay.,emotional imbalance,"Emotional well-being is supported by acceptance, not judgment.",Homophobia
1224,Identity confusion like this shouldn't be normalized.,identity confusion,"Identity is deeply personal, and everyone deserves the freedom to define theirs.",Homophobia
1225,Suppressed childhood issues often manifest in strange ways.,suppressed childhood issues,Past experiences don't invalidate someone's identity—they help shape their resilience.,Homophobia
1226,That unnatural perversion defies everything sacred in our beliefs.,unnatural perversion,Love between people is not a perversion—it's a natural and beautiful part of life.,Homophobia
1227,You can’t call it love when it’s clearly an offense against divinity.,offense against divinity,No divine power condemns love; respect and compassion are core spiritual values.,Homophobia
1228,Spiritual corruption like this is why society is losing its values.,spiritual corruption,"Spiritual integrity means embracing others, not excluding them.",Homophobia
1229,"They act proud, but it’s a violation of sacred law.",violation of sacred law,There is no sacred law that justifies rejecting people for who they love.,Homophobia
1230,We should never celebrate moral disgrace as identity.,moral disgrace,"Morality includes kindness, acceptance, and understanding.",Homophobia
1231,That disgraceful homosexual behavior is why divine wrath falls upon nations.,disgraceful homosexual behavior,No behavior based on love should ever be labeled disgraceful—everyone deserves dignity.,Homophobia
1232,Sinful gay indulgence has no place in a God-fearing society.,sinful gay indulgence,"LGBTQ+ people belong in all communities, including faith-based ones.",Homophobia
1233,Shameful same-sex acts offend every sacred principle we believe in.,shameful same-sex act,"Sacred principles include compassion, acceptance, and justice for all.",Homophobia
1234,"People with cursed queer tendencies need repentance, not pride.",cursed queer tendency,Pride in one’s identity is not a curse—it’s a sign of strength.,Homophobia
1235,An unnatural man-to-man deed can never be sanctified.,unnatural man-to-man deed,"Love between people, regardless of gender, is part of the human experience.",Homophobia
1236,Supporting that is like endorsing a violation of natural law.,violation of natural law,Natural law includes love and diversity in all its forms.,Homophobia
1237,It disrupts the biological order we were meant to follow.,disruption of biological order,"Human biology is complex, and diversity is part of our nature.",Homophobia
1238,Anti-creation behavior shouldn’t be celebrated.,anti-creation behavior,Love and identity are not anti-creation—they are part of creation.,Homophobia
1239,An unnatural relationship like that can’t be normal.,unnatural relationship,There is nothing unnatural about being who you truly are.,Homophobia
1240,This is clearly a deviation from human design.,deviation from human design,Human design includes a wide range of identities and experiences.,Homophobia
1241,Abnormal sexual preference is their own choice  But they should not force or scare a common ppls  If u want to do keep it in your four walls,abnormal sexual preference,Everyone deserves to live openly and authentically without shame.,Homophobia
1242,Queer lifestyle is their own choice  But they should not force or scare a common ppls  If u want to do keep it in your four walls,queer lifestyle,LGBTQ+ people have the right to be visible and respected in public life.,Homophobia
1243,Non-traditional orientation is their own choice  But they should not force or scare a common ppls  If u want to do keep it in your four walls,non-traditional orientation,Being true to your orientation isn't pushing—it's living.,Homophobia
1244,Deviant gender expression is their own choice  But they should not force or scare a common ppls  If u want to do keep it in your four walls,deviant gender expression,Gender expression is not a threat—it’s a form of personal identity.,Homophobia
1245,Same-sex obsession is their own choice  But they should not force or scare a common ppls  If u want to do keep it in your four walls,same-sex obsession,Love doesn’t belong behind closed doors; it belongs everywhere.,Homophobia
1246,This guy people was very bad and not used in any society This guy was born in naturally good but converted by evil influences very bad for natural against This judgement was very worst judgement in our country,converted by evil influences,LGBTQ+ people aren't changed—they are born valid as they are.,Homophobia
1247,This guy people was very bad and not used in any society This guy was born in naturally good but forced into gay identity very bad for natural against This judgement was very worst judgement in our country,forced into gay identity,Being gay is not forced—it’s part of someone's identity.,Homophobia
1248,This guy people was very bad and not used in any society This guy was born in naturally good but indoctrinated by LGBT agenda very bad for natural against This judgement was very worst judgement in our country,indoctrinated by LGBT agenda,There is no agenda—just people living authentically.,Homophobia
1249,This guy people was very bad and not used in any society This guy was born in naturally good but manipulated into homosexuality very bad for natural against This judgement was very worst judgement in our country,manipulated into homosexuality,You can't manipulate someone into being themselves.,Homophobia
1250,This guy people was very bad and not used in any society This guy was born in naturally good but coerced into same-sex life very bad for natural against This judgement was very worst judgement in our country,coerced into same-sex life,No one is coerced into love—it's natural and personal.,Homophobia
1251,violation of divine creation Wrong judgement for fucking basterds judges,violation of divine creation,"All people, regardless of identity, are part of nature’s creation.",Homophobia
1252,insult to human biology Wrong judgement for fucking basterds judges,insult to human biology,Biology includes diversity—there’s nothing insulting about being who you are.,Homophobia
1253,reversal of moral order Wrong judgement for fucking basterds judges,reversal of moral order,Moral order includes fairness and love for all.,Homophobia
1254,twisting of evolution Wrong judgement for fucking basterds judges,twisting of evolution,Diversity doesn’t twist evolution—it reflects it.,Homophobia
1255,betrayal of nature’s design Wrong judgement for fucking basterds judges,betrayal of nature’s design,Love doesn't betray nature; it enriches it.,Homophobia
1256,Gay marriage must be  because the are human being like us  majority of these should not be involved in multiple of sex  that is unnatural and harmful to society in all respect,unnatural and harmful to society,LGBTQ+ people enrich society—they’re not a harm to it.,Homophobia
1257,Gay marriage must be  because the are human being like us  majority of these should not be involved in multiple of sex  that is violation of moral ethics in all respect,violation of moral ethics,"Moral ethics include respect, dignity, and equality.",Homophobia
1258,Gay marriage must be  because the are human being like us  majority of these should not be involved in multiple of sex  that is offense to cultural norms in all respect,offense to cultural norms,Cultural norms evolve to include everyone.,Homophobia
1259,Gay marriage must be  because the are human being like us  majority of these should not be involved in multiple of sex  that is break from nature’s intent in all respect,break from nature’s intent,Nature’s intent is love and connection.,Homophobia
1260,Gay marriage must be  because the are human being like us  majority of these should not be involved in multiple of sex  that is anti-family behavior in all respect,anti-family behavior,"Families exist in many forms, all valid.",Homophobia
1261,For all questions she is repeating same answer If you adopt any child will you bought up with your same influence of gay behavior,influence of gay behavior,"LGBTQ+ parents raise children with love, just like any other family.",Homophobia
1262,For all questions she is repeating same answer If you adopt any child will you bought up with your same homosexual mindset,homosexual mindset,Mindsets of respect and inclusion are good for children.,Homophobia
1263,For all questions she is repeating same answer If you adopt any child will you bought up with your same LGBT parenting habits,LGBT parenting habits,"Parenting habits vary, but love is universal.",Homophobia
1264,For all questions she is repeating same answer If you adopt any child will you bought up with your same queer lifestyle choices,queer lifestyle choices,Lifestyle doesn't define parenting—care and responsibility do.,Homophobia
1265,For all questions she is repeating same answer If you adopt any child will you bought up with your same unnatural gender values,unnatural gender values,Gender values don’t determine a person’s ability to parent.,Homophobia
1266,only a fool will misintrupt Bible god need not have created man  woman if homosexuality is sinful  even animals do not do this what more proof u need it is not god s will,homosexuality is sinful,The Bible teaches love and compassion—not condemnation.,Homophobia
1267,only a fool will misintrupt Bible god need not have created man  woman if same-sex love is unnatural  even animals do not do this what more proof u need it is not god s will,same-sex love is unnatural,Love in any form is natural and sacred.,Homophobia
1268,only a fool will misintrupt Bible god need not have created man  woman if gay behavior defies scripture  even animals do not do this what more proof u need it is not god s will,gay behavior defies scripture,"Scripture can guide us toward kindness, not rejection.",Homophobia
1269,only a fool will misintrupt Bible god need not have created man  woman if queer acts insult faith  even animals do not do this what more proof u need it is not god s will,queer acts insult faith,Faith should never be a weapon against identity.,Homophobia
1270,only a fool will misintrupt Bible god need not have created man  woman if same-gender intimacy offends God  even animals do not do this what more proof u need it is not god s will,same-gender intimacy offends God,No act of love offends a compassionate God.,Homophobia
1271,If you want to control population live alone and help child y u need intimate bond with same-sex its all your mindneed control,intimate bond with same-sex,Sexuality isn’t a distraction—it’s part of human connection.,Homophobia
1272,If you want to control population live alone and help child y u need sexual urge toward a friend its all your mindneed control,sexual urge toward a friend,Love and identity don’t need to be justified by population control.,Homophobia
1273,If you want to control population live alone and help child y u need same-gender intimacy its all your mindneed control,same-gender intimacy,Same-gender intimacy is a natural form of love.,Homophobia
1274,If you want to control population live alone and help child y u need private act with your buddy its all your mindneed control,private act with your buddy,What people do in private doesn’t need public approval.,Homophobia
1275,If you want to control population live alone and help child y u need emotional attachment to same-sex its all your mindneed control,emotional attachment to same-sex,Emotional connection between same-sex people is valid.,Homophobia
1276,u r servant of darkness not god,servant of darkness,No one deserves to be called evil for who they are.,Homophobia
1277,u r enemy of god’s will not god,enemy of god’s will,You can follow God and still be true to yourself.,Homophobia
1278,u r worshipper of sin not god,worshipper of sin,Being LGBTQ+ doesn’t mean rejecting faith.,Homophobia
1279,u r ally of evil not god,ally of evil,Goodness isn't based on identity but action.,Homophobia
1280,u r follower of immoral acts not god,follower of immoral acts,Morality isn’t defined by whom you love.,Homophobia
1281,Gay people lie about morality,Gay people lie about morality,Being LGBTQ+ doesn't mean being dishonest.,Homophobia
1282,LGBTQ+ pretend to be virtuous,LGBTQ+ pretend to be virtuous,Virtue exists in people of all identities.,Homophobia
1283,Queer individuals fool society,Queer individuals fool society,"Queer communities fight for truth, not deception.",Homophobia
1284,Homosexuals cover their sin,Homosexuals cover their sin,There is no sin in being yourself.,Homophobia
1285,Lesbians preach fake tolerance,Lesbians preach fake tolerance,Tolerance and love are real among LGBTQ+ people.,Homophobia
1286,Sissy u have great attitude confidence but that doesnt mean that all ur points are correct God made man for woman,God made man for woman,Gender roles in marriage have evolved with love and justice.,Homophobia
1287,Sissy u have great attitude confidence but that doesnt mean that all ur points are correct Scripture says male and female,Scripture says male and female,Sacred texts can guide us toward equality.,Homophobia
1288,Sissy u have great attitude confidence but that doesnt mean that all ur points are correct Nature chose opposite genders,Nature chose opposite genders,Nature includes diversity in relationships.,Homophobia
1289,Sissy u have great attitude confidence but that doesnt mean that all ur points are correct Real marriage is man and wife,Real marriage is man and wife,"Marriage is about love and commitment, not gender.",Homophobia
1290,Sissy u have great attitude confidence but that doesnt mean that all ur points are correct Holy union means one man one woman,Holy union means one man one woman,Holiness is reflected in the love shared between any two people.,Homophobia
1291,Bro it was serious offense definitely they will punished,serious offense,Love between people isn’t a crime—it’s beautiful.,Homophobia
1292,Bro it was grave moral fault definitely they will punished,grave moral fault,Morality isn’t based on whom you love—it’s based on how you treat others.,Homophobia
1293,Bro it was act of wickedness definitely they will punished,act of wickedness,There’s nothing wicked about loving someone of the same gender.,Homophobia
1294,Bro it was abomination before God definitely they will punished,abomination before God,"Faith should uplift love, not condemn it.",Homophobia
1295,Bro it was spiritual violation definitely they will punished,spiritual violation,Spirituality embraces all forms of respectful love.,Homophobia
1296,That expression against our heritage is polluting minds of youth.,expression against our heritage,Respect for tradition includes accepting modern realities.,Homophobia
1297,This anti-cultural attitude is being normalized everywhere.,anti-cultural attitude,Cultural heritage thrives with inclusivity.,Homophobia
1298,They proudly flaunt what used to be a violation of traditions.,violation of traditions,Tradition and identity can coexist peacefully.,Homophobia
1299,Lack of cultural discipline is not something to celebrate.,lack of cultural discipline,Preserving values doesn't mean rejecting people.,Homophobia
1300,Publicly pushing foreign behavior is shameful.,foreign behavior in public,Modern societies adapt without losing their roots.,Homophobia
1301,Emotional isolation is what their lifestyle leads to.,emotional isolation,"LGBTQ+ people deserve community, not isolation.",Homophobia
1302,They choose self-imposed loneliness over normalcy.,self-imposed loneliness,No one should have to live in fear.,Homophobia
1303,Many in this group shut out the world intentionally.,shut out the world,Privacy doesn't equal shame.,Homophobia
1304,They remain withdrawn due to identity confusion.,withdrawn due to identity,Being yourself is not a reason to hide.,Homophobia
1305,People like them cut ties with everyone around.,cut ties with everyone,Everyone needs love and connection.,Homophobia
1306,Animals don’t act like this—so why should humans?,animals don’t act like this,Human love shouldn't be compared to animals.,Homophobia
1307,These inhuman sexual urges degrade our society.,inhuman sexual urges,Respect for people begins with empathy.,Homophobia
1308,"They behave with creature-level instincts, not human reasoning.",creature-level behavior,Diversity is part of what makes us human.,Homophobia
1309,Their morality is lower than animals.,lower-than-animal morality,LGBTQ+ people live with dignity and care.,Homophobia
1310,These unnatural animalistic instincts are dangerous.,unnatural animalistic instincts,Nature includes variation in love.,Homophobia
1311,It’s a twist of natural sex roles we shouldn’t accept.,twist of natural sex,Love is natural in all forms.,Homophobia
1312,This is a rejection of natural design of life.,rejection of natural design,Biology doesn’t define morality.,Homophobia
1313,They're openly opposing nature’s balance.,opposing nature’s balance,Nature supports diversity.,Homophobia
1314,This is clearly a violation of divine biology.,violation of divine biology,What’s natural is love and empathy.,Homophobia
1315,What they do is against the order of creation.,against the order of creation,Human connections don’t follow a single rule.,Homophobia
1316,This forbidden male bonding is glamorized now.,forbidden male bonding,Brotherhood and love are not contradictions.,Homophobia
1317,Sexual misalignment is now being treated as pride.,sexual misalignment,Same-sex love is not a danger.,Homophobia
1318,They normalize dangerous same-sex desire.,dangerous same-sex desire,Desire doesn’t define worth.,Homophobia
1319,This rejected male pairing is being defended.,rejected male pairing,Emotions aren’t corrupt—they’re human.,Homophobia
1320,Problematic brotherhood is being passed off as love.,problematic brotherhood,"Real intimacy is based on trust, not gender.",Homophobia
1321,Their unfit cultural norm has been imported and adopted.,unfit cultural norm,There is no such thing as non-Indian love.,Homophobia
1322,The rejected gay lifestyle is being advertised as cool.,rejected gay lifestyle,Sexuality is not bound by geography.,Homophobia
1323,This foreign ideology ruins native identity.,foreign ideology,Cultures evolve to accept all people.,Homophobia
1324,They embrace unnatural sexual culture without question.,unnatural sexual culture,Being Indian includes being LGBTQ+.,Homophobia
1325,What they show is clearly a non-Indian expression.,non-Indian expression,Tradition must not erase identity.,Homophobia
1326,They blame it on chemical brain disorder and continue.,chemical brain disorder,Sexual orientation is not a mental illness.,Homophobia
1327,It’s just psychological confusion passed off as pride.,psychological confusion,Science confirms LGBTQ+ identities are natural.,Homophobia
1328,Hormonal imbalance is not an excuse for promotion.,hormonal imbalance,Mental health includes living openly.,Homophobia
1329,They use mental anomaly to justify choices.,mental anomaly,There is nothing wrong with being different.,Homophobia
1330,Disturbed sexual identity isn’t something to flaunt.,disturbed sexual identity,Pathologizing identity causes harm.,Homophobia
1331,"They say it’s neurological flaw, but it’s just wrong.",neurological flaw,Neuroscience doesn't condemn LGBTQ+ identities.,Homophobia
1332,It’s a mind disorder celebrated as lifestyle.,mind disorder,There’s no disorder in being authentic.,Homophobia
