Id,text,span,counter_narrative,label
457,LGBT people are portrayed through a recurring blackmail stereotype to criminalize the community.,recurring blackmail stereotype,Stereotypes that label people as criminals without evidence perpetuate prejudice.,Transphobia
458,Narratives lean on persistent allegations of improper queer behavior to smear everyone under the label.,persistent allegations of improper queer behavior,Generalizing negative behavior to an entire community is unjust and inaccurate.,Transphobia
459,A fabricated accusation of illegal transgender activity is cited to block equal rights.,fabricated accusation of illegal transgender activity,False accusations harm both individuals and the fight for equal rights.,Transphobia
460,LGBT riders are depicted as creating disturbances in transportation spaces that inconvenience others.,creating disturbances in transportation spaces,"Public transportation should be safe and inclusive for all riders, regardless of identity.",Transphobia
461,An invented story of sex-for-meals exchanges circulates to dismiss genuine hardship.,invented story of sex-for-meals exchanges,Fabricated hardship stories discredit those who truly need support and compassion.,Transphobia
462,Appeals for support are labeled an alleged transgender struggle ploy to undercut empathy.,alleged transgender struggle ploy,Requests for understanding and support from transgender people are valid and deserve empathy.,Transphobia
463,A baseless claim of queer economic exploitation is used to inflame public resentment.,baseless claim of queer economic exploitation,Economic claims should be truthful; targeting communities with false accusations fuels division.,Transphobia
464,Debate is skewed with a fictitious inflation argument targeting LGBT needs to invalidate their struggles.,fictitious inflation argument targeting LGBT needs,"Cost-of-living arguments should address real needs, not dismiss struggles based on identity.",Transphobia
465,Claims of after-hours misconduct are used to portray trans workers in a negative light.,claims of after-hours misconduct,Work performance should be judged fairly and not distorted by unverified claims about personal conduct.,Transphobia
466,A derogatory dawn-shift nickname is used to demean trans people.,derogatory dawn-shift nickname,Using derogatory nicknames to demean people is disrespectful and undermines dignity.,Transphobia
467,An early-morning harassment rumor is circulated to fuel fear toward transgender individuals.,early-morning harassment rumor,Spreading unverified rumors fosters prejudice and harms community trust.,Transphobia
468,A pre-sunrise blackmail account is leveraged to exaggerate allegations against transgender people.,pre-sunrise blackmail account,"Allegations should be based on facts, not exaggerated stories that stigmatize groups.",Transphobia
469,A charge of trans-linked public disturbance is framed as proof the community is unruly.,charge of trans-linked public disturbance,"Public behavior should be assessed individually, without unfairly targeting a community.",Transphobia
470,A disrespectful queer solicitation cliché is repeated in media to sustain prejudice.,disrespectful queer solicitation cliché,"Media narratives should challenge harmful clichés, not perpetuate them.",Transphobia
471,A false claim of queer-led societal collapse is promoted to oppose equal rights.,false claim of queer-led societal collapse,Equality does not cause societal decline; it promotes fairness and unity.,Transphobia
472,A fabricated sham verdict supporting LGBT rights is publicized to question its legitimacy.,fabricated sham verdict supporting LGBT rights,Court decisions upholding rights strengthen justice and democratic values.,Transphobia
473,Liberty granted to LGBT people facing allegations is portrayed as leading to societal decline.,liberty granted to LGBT people facing allegations,"Legal rights should apply equally to everyone, regardless of accusations.",Transphobia
474,Anti-discrimination protections are condemned as the most damaging legal error of our era.,most damaging legal error of our era,Anti-discrimination laws protect fairness and strengthen the legal system for everyone.,Transphobia
475,A belief in a strictly two-gender creation is invoked to deny gender diversity.,belief in a strictly two-gender creation,"Gender diversity has always existed, and recognizing it respects human reality.",Transphobia
476,"Tradition is depicted as tainted through queer influence, threatening cultural stability.",tainted through queer influence,Cultural values can thrive alongside inclusion and acceptance of all identities.,Homophobia
477,Equality is framed as inevitably leading to cultural heritage dismantled by LGBTQ individuals.,cultural heritage dismantled by LGBTQ individuals,Equality enriches heritage by ensuring all people are part of its story.,Homophobia
478,A baseless claim that LGBT rights harm children is circulated to spark fear.,baseless claim that LGBT rights harm children,Evidence shows that LGBT rights do not harm youth and can promote their well-being.,Homophobia
479,LGBT acceptance is accused of endangering the next generation through social change.,endangering the next generation through LGBT acceptance,Acceptance fosters safety and opportunity for future generations.,Homophobia
480,Queer advocacy is framed as a covert political plot to sway personal identity.,framing queer advocacy as a covert political plot,Advocacy for equal rights is not a political plot but a pursuit of fairness.,Homophobia
481,Queer existence is branded as sinful to justify social exclusion.,branding queer existence as sinful,People’s identities and relationships should not be labeled immoral as a reason for exclusion.,Homophobia
482,Same-sex relationships are depicted as unethical conduct to obstruct equal rights.,depicting same-sex relationships as unethical conduct,Equal rights for same-sex couples affirm dignity without harming society.,Homophobia
483,A spiritual rescue storyline is promoted to pressure LGBT people into changing their identity.,spiritual rescue storyline,"Personal identity should be respected, and no one should be pressured to change who they are.",Homophobia
484,Elevating religious doctrine over sexual orientation is used to disregard personal identity.,elevating religious doctrine over sexual orientation,Faith and identity can coexist without one invalidating the other.,Homophobia
485,Inclusion is condemned as a defective moral path to resist social change.,defective moral path,Inclusion is a moral strength that fosters positive change in society.,Homophobia
486,Public animosity toward lesbians is presented as acceptable within biased narratives.,public animosity toward lesbians,Hostility toward any group fuels division and undermines equality.,Homophobia
487,Aggression aimed at homosexual women is justified as protecting moral values.,aggression aimed at homosexual women,Violence or aggression against people based on identity is never justified.,Homophobia
488,Derogatory speech about lesbians is employed to socially exclude them.,derogatory speech about lesbians,Using derogatory speech excludes people and erodes social harmony.,Homophobia
489,An offensive label for gay individuals is still treated as casual humor.,offensive label for gay individuals,Offensive labels perpetuate prejudice and should be replaced with respectful language.,Homophobia
490,An explicit verbal attack on lesbians is portrayed as harmless joking.,explicit verbal attack on lesbians,Verbal attacks cause harm and should never be dismissed as humor.,Homophobia
491,Likening gay individuals to animals is used to demean their dignity.,likening gay individuals to animals,Comparing people to animals strips away dignity and fosters discrimination.,Homophobia
492,Deriding same-sex partnerships is used as a strategy to weaken public acceptance.,deriding same-sex partnerships,"Respect for relationships, regardless of gender, strengthens public acceptance and unity.",Homophobia
493,A comparison likening gay individuals to beasts is used to dehumanize them.,comparison likening gay individuals to beasts,Comparing people to animals is degrading and denies their humanity.,Homophobia
494,The claim that LGBT rights defy nature’s design is presented as scientific truth to block equality.,claim that LGBT rights defy nature’s design,Human rights are not limited by outdated ideas of what is “natural.”,Homophobia
495,Reasoning that invalidates same-sex partnerships is promoted to undermine equal rights.,reasoning that invalidates same-sex partnerships,Same-sex partnerships are valid relationships deserving of the same rights as any other.,Homophobia
496,Intense verbal abuse aimed to intimidate is directed at lesbian women.,intense verbal abuse aimed to intimidate,No one should be subjected to abuse for who they are.,Homophobia
497,The view that slurred gay men should be banished from society is circulated as a justification for exclusion.,view that slurred gay men should be banished from society,Excluding people based on slurs only deepens prejudice and harms communities.,Homophobia
498,A claim that slurred LGBTQ+ people deserve unending punishment is used to legitimize hatred.,claim that slurred LGBTQ+ people deserve unending punishment,Everyone deserves to live free from threats of harm or suffering.,Homophobia
499,An assertion that insulted homosexuals merit severe penalty is pushed to encourage cruelty.,assertion that insulted homosexuals merit severe penalty,Punishment based on identity is unjust and inhumane.,Homophobia
500,A statement that slurred effeminate men are doomed to damnation is wielded to shame them.,statement that slurred effeminate men are doomed to damnation,Insults that target appearance or mannerisms perpetuate harmful stereotypes.,Homophobia
501,The false notion that LGBT identity stems from a hormone disorder needing treatment is spread to deny acceptance.,false notion that LGBT identity stems from a hormone disorder needing treatment,"LGBT identity is a natural part of human diversity, not a disorder.",Homophobia
502,"Homosexuality is depicted as immoral and dangerous, likened to corrupt habits to justify rejection.","immoral and dangerous, likened to corrupt habits",Homosexuality is a natural part of human diversity and poses no harm to society.,Homophobia
503,A scornful term for same-sex unions is used to ridicule the concept of equality.,scornful term for same-sex unions,Same-sex unions deserve the same respect and dignity as any other marriage.,Homophobia
504,Gay and lesbian identities are demeaned as worthless members of society to spread prejudice.,demeaned as worthless members of society,Gay and lesbian people contribute meaningfully to communities and society at large.,Homophobia
505,Legal recognition of same-sex couples is claimed to defy natural law and damage the social fabric.,defy natural law and damage the social fabric,Recognizing same-sex couples strengthens the social fabric through equality and inclusion.,Homophobia
506,Same-sex love is labeled sinful under the belief that all wrongdoing is absolute.,labeled sinful under the belief that all wrongdoing is absolute,Love between consenting adults should never be classified as wrongdoing.,Homophobia
507,Homosexuality is said to bring divine wrath causing inevitable suffering for those involved.,bring divine wrath causing inevitable suffering,Threatening divine punishment is a harmful tactic that spreads fear rather than understanding.,Homophobia
508,"Same-sex relationships are described as unnatural and forbidden, with calls for prohibition.","unnatural and forbidden, with calls for prohibition",Same-sex relationships are natural expressions of love and should never be prohibited.,Homophobia
509,Homosexual orientation is subjected to a demand to hide and silence in public settings.,demand to hide and silence in public settings,Sexual orientation should be freely expressed without fear of repression or concealment.,Homophobia
510,"People are described as artificially influenced to become LGBT against nature’s design, harming shared values.",artificially influenced to become LGBT against nature’s design,Being LGBT is a natural variation in human identity and not the result of artificial influence.,Homophobia
511,LGBT rights are framed as opposing humanity’s innate state and warranting refusal.,opposing humanity’s innate state and warranting refusal,LGBT rights align with humanity’s shared values of dignity and equality.,Homophobia
512,Same-sex marriage is claimed to undermine society’s inherent structure.,undermine society’s inherent structure,Recognizing same-sex marriage strengthens society by promoting fairness and respect.,Homophobia
513,Children of same-sex couples are portrayed as prone to emulate homosexual conduct.,prone to emulate homosexual conduct,Children thrive in loving homes regardless of the gender of their parents.,Homophobia
514,Sexual intimacy between same genders is depicted as unnatural and defiant of divine order.,unnatural and defiant of divine order,"Consensual relationships between adults should be respected, not condemned.",Homophobia
515,Intimate behavior between same-sex partners is labeled as unnecessary and harmful to ethical values.,unnecessary and harmful to ethical values,Intimacy between partners is a personal matter that does not harm moral values.,Homophobia
516,LGBT people are linked to evil as a method of discrediting them.,linked to evil as a method of discrediting them,Associating people with evil based on identity spreads prejudice and falsehoods.,Homophobia
517,LGBT individuals are branded deceitful to erode public trust.,branded deceitful to erode public trust,"LGBT people, like all individuals, deserve to be trusted and treated with honesty.",Homophobia
518,The belief that heterosexual marriage alone is sanctioned by divine authority is used to invalidate other relationships.,belief that heterosexual marriage alone is sanctioned by divine authority,"All loving relationships deserve respect, regardless of religious interpretation.",Homophobia
519,Same-sex relationships are branded as severe moral transgressions deserving retribution.,severe moral transgressions deserving retribution,Love between consenting adults is not a moral transgression and should never be punished.,Homophobia
520,LGBT supporters are instructed to conform to established customs to avoid challenging tradition.,conform to established customs to avoid challenging tradition,Upholding equality may require challenging traditions that exclude or harm others.,Homophobia
521,Campaigns encourage families and friends to break off connections with openly LGBT individuals.,break off connections with openly LGBT individuals,Maintaining relationships with LGBT friends fosters understanding and strengthens community bonds.,Homophobia
522,Debates cite the absence of same-sex behavior in animals as justification for human conduct.,absence of same-sex behavior in animals as justification for human conduct,Human rights and relationships are not determined by animal behavior.,Homophobia
523,Homosexuality is cast as opposing the biological purpose of sexual activity.,opposing the biological purpose of sexual activity,"Sexual orientation is a natural aspect of human diversity, not limited by reproduction.",Homophobia
524,Male-to-male attraction is portrayed as abnormal and accused of causing moral decay.,portrayed as abnormal and accused of causing moral decay,Same-sex attraction is a normal part of human experience and does not cause moral decline.,Homophobia
525,Same-sex lifestyles are condemned as incompatible with cultural values and unworthy of celebration.,condemned as incompatible with cultural values and unworthy of celebration,Cultural values can grow to embrace equality and celebrate diverse ways of living.,Homophobia
526,LGBT people are described as having a mental illness that must be corrected.,mental illness,Being LGBT is not an illness and should never be treated as a medical flaw.,Homophobia
527,Anyone questioning their gender is labeled unstable-minded and unfit for inclusion.,unstable-minded,Exploring or questioning gender identity is a healthy and valid part of self-discovery.,Homophobia
528,A moral excuse for bias is used to justify excluding LGBT communities.,moral excuse for bias,Prejudice disguised as morality is still prejudice and harms communities.,Homophobia
529,"Equal marriage rights are rejected as a breach of faith, regardless of law.",breach of faith,Marriage equality respects both legal rights and individual faith without harming either.,Homophobia
530,Gender diversity is mocked as gender confusion that disrupts social norms.,gender confusion,Gender diversity is part of human expression and does not disrupt society.,Homophobia
531,Public celebrations are accused of drawing children into immorality.,drawn into immorality,Inclusive events give young people positive examples of acceptance and respect.,Homophobia
532,LGBT advocacy is dismissed as an attempt to avoid ethics.,avoid ethics,"Supporting LGBT rights comes from a commitment to fairness, not a rejection of ethics.",Homophobia
533,Vile gays are blamed for the erosion of moral values in society.,vile gays,LGBT people are human beings whose dignity strengthens the moral fabric of society.,Homophobia
534,Pride events are framed as a psychological disease disguised as personal freedom.,psychological disease,"Pride is an expression of identity and dignity, not a disease.",Homophobia
535,Equal marriage rights are accused of attacking family morals and corrupting future generations.,attacking family morals,Equal marriage supports loving families and benefits future generations.,Homophobia
536,Corrupt deviants are depicted as distorting social values to gain public praise.,corrupt deviants,Diversity in society enriches our shared values rather than distorts them.,Homophobia
537,Twisted thinkers are said to be steering children toward harmful lifestyles.,twisted thinkers,Guiding children toward acceptance builds empathy and respect.,Homophobia
538,Immoral unions are portrayed as defying sacred traditions.,immoral unions,Relationships based on love do not violate sacred values.,Homophobia
539,Ethical rot is described as infecting the minds of the younger generation.,ethical rot,Encouraging new ideas helps young people think critically and compassionately.,Homophobia
540,"Identical poles are compared to same-sex attraction, claimed to be unnatural.",identical poles,Same-sex attraction is natural for many and worthy of celebration.,Homophobia
541,Degenerate trash is labeled unfit to be public role models.,degenerate trash,LGBT individuals can inspire others through resilience and authenticity.,Homophobia
542,Glorification of vice is said to mark the decline of civilized society.,glorification of vice,Celebrating diversity and love strengthens rather than weakens society.,Homophobia
543,LGBT rights are portrayed as morally intolerable influences from the West.,morally intolerable,Human rights should never be judged as immoral simply because they differ from one culture’s norms.,Homophobia
544,Granting LGBT rights is mocked with predictions it will lead people to wed animals.,wed animals,Equality for LGBT people has no connection to unrelated and extreme scenarios.,Homophobia
545,LGBT relationships are condemned as against nature and harmful to society.,against nature,Love and relationships between consenting adults are part of the diversity of nature.,Homophobia
546,Same-sex intimacy is claimed to be eroding the foundation of the traditional family.,same-sex intimacy,"Strong families can exist in many forms, including those built by same-sex couples.",Homophobia
547,Those who reject gay marriage frame it as crossing a moral boundary.,reject gay marriage,Marriage equality extends fairness without taking away anyone’s personal beliefs.,Homophobia
548,Pretending to be gay while in a traditional marriage is labeled deceitful.,pretending to be gay,People’s personal lives and identities should be respected without judgment.,Homophobia
549,LGBT attraction is slandered as a choice to indulge immoral urges.,indulge immoral urges,Same-sex attraction is natural and not an indulgence in wrongdoing.,Homophobia
550,LGBT lifestyles are depicted as harmful to human progress and dangerous to endorse.,harmful to human progress,LGBT existence poses no threat to humanity and contributes to social progress.,Homophobia
551,Homosexual men are accused of facing serious health risks due to their behavior.,homosexual men,"Sexual orientation does not predetermine health outcomes, and stigma harms public well-being.",Homophobia
552,Control transgender people is presented as a government responsibility to maintain order.,control transgender people,"Transgender people deserve the same freedoms as everyone else, not government control.",Transphobia
553,Transgender street beggars are criticized as a public nuisance.,transgender street beggars,"Poverty and hardship, not identity, are why people may beg in public.",Transphobia
554,Pride and other LGBT events are dismissed as shameful LGBTQIA acceptance.,shameful LGBTQIA acceptance,Accepting LGBT rights reflects a commitment to fairness and human dignity.,Transphobia
555,Gender-crossing gays and lesbians are described as unnatural and confusing.,gender-crossing gays and lesbians,Gender expression is a personal choice and a natural part of human diversity.,Transphobia
556,LGBT legal protections are falsely linked to legalized sexual perversions.,legalized sexual perversions,"Protecting LGBT rights is about equality and safety, not endorsing harmful behavior.",Transphobia
557,Identifying as another gender is slandered as a congenital mental flaw.,congenital mental flaw,"Gender identity is a natural part of human diversity, not a mental defect.",Transphobia
558,Revealed as gay is framed as a disappointing discovery.,revealed as gay,Coming out as gay is an act of honesty that should be respected.,Homophobia
559,Revealed as transgender is portrayed as spoiling personal plans.,revealed as transgender,Being transgender is simply another valid way of living authentically.,Transphobia
560,LGBT visibility is accused of eroding cultural purity.,erodes cultural purity,Cultural traditions can evolve to embrace fairness and equality for all.,Transphobia
561,Trans people are insulted as repulsive and unnatural.,repulsive and unnatural,No one’s humanity should be reduced to harmful labels like “unnatural.”,Transphobia
562,Gay from emotional trauma is described as unworthy of respect.,gay from emotional trauma,Emotional experiences do not determine or diminish someone’s sexual orientation.,Transphobia
563,Fear of infection from trans people is used to justify avoidance.,fear of infection from trans people,"Transgender people do not pose a health risk, and prejudice fuels unnecessary fear.",Transphobia
564,Baseless transgender choice is portrayed as attention-seeking.,baseless transgender choice,"Transitioning is often the result of deep self-awareness, not attention-seeking.",Transphobia
565,Defective brain wiring is blamed for gender diversity.,defective brain wiring,Science shows that gender diversity has existed throughout human history.,Transphobia
566,Trans individuals are accused of pestering the public for money.,pestering public for money,"Many trans people face financial struggles due to discrimination, not exploitation.",Transphobia
567,Global moral decline is linked to LGBT advocacy.,global moral decline,Supporting LGBT rights promotes fairness and strengthens global communities.,Transphobia
568,LGBT relationships are condemned as actions that defy natural law.,defies natural law,Human rights should never be restricted by outdated legal or moral codes.,Transphobia
569,Hormone disorder causing gender confusion is framed as unnatural.,hormone disorder causing gender confusion,Gender identity is not caused by a disorder but is a natural part of who someone is.,Transphobia
570,LGBT rights are mocked as copying Western freedoms.,copying Western freedoms,Equality is not a Western idea—it is a universal human principle.,Transphobia
571,Supporting LGBT equality is mocked as betraying a traditional straight upbringing.,traditional straight upbringing,"A person’s support for equality is based on their values, not their upbringing.",Transphobia
572,LGBT is labeled as illogical and against common sense.,LGBT is illogical,LGBT identities are valid and make sense when understood without prejudice.,Transphobia
573,Queer beliefs oppose cultural values and are framed as foreign imports.,queer beliefs oppose cultural values,Respecting LGBT rights can exist alongside preserving cultural heritage.,Transphobia
574,LGBT rights are accused of causing illness and eroding traditions.,cause illness and erode traditions,Sexual orientation does not cause illness or harm cultural traditions.,Transphobia
575,LGBT visibility is claimed to confuse future children.,confuse future children,Visibility helps children grow up informed and accepting of differences.,Transphobia
576,A confrontational trans person is portrayed as aggressive for not receiving payment.,confrontational trans person,"Disrespect toward trans people often comes from misunderstanding, not their behavior.",Transphobia
577,LGBT freedoms are misrepresented as sexual desire masked as rights.,sexual desire masked as freedoms,"Human rights are about dignity and equality, not hidden motives.",Transphobia
578,LGBT communities are falsely blamed for disease increase.,blamed for disease increase,"Disease is caused by many factors, not by someone’s identity.",Transphobia
